{
  "schemaVersion": "1.0.0",
  "approvalId": "APR-AD-EC-12000-001",
  "gate": "AUTOMATION_DESIGN",
  "artifactId": "TP-EC-12000-001",
  "artifactVersion": 1,
  "release": "26.3",
  "capability": "paper-out-export",
  "sourceArtifactPath": "features/generated/paper-out-export/paper-out-media-type.feature",
  "decision": "APPROVE",
  "reviewer": {
    "name": "Anil",
    "role": "Business/QA Reviewer",
    "reference": null
  },
  "reviewedAt": "2026-09-11T11:16:12.000Z",
  "comments": "Approved. Confirms: (1) every locator listed MCP_VALIDATION_REQUIRED in TP-EC-12000-001-automation-design.md may be validated by Playwright MCP at PLAYWRIGHT_VALIDATION without a further design review, and (2) the eoRequestExport contract for TS-011 through -015 stays scaffolding-only (API_CONTRACT_UNVERIFIED) until observed and promoted to HUMAN_APPROVED by a human reviewer - this gate does not itself authorize treating that contract as authoritative.",
  "itemDecisions": [
    {
      "itemId": "TS-EC-12000-001",
      "decision": "APPROVE",
      "comment": "Media Type section renders with Print to Paper default. UI, all locators MCP_VALIDATION_REQUIRED."
    },
    {
      "itemId": "TS-EC-12000-002",
      "decision": "APPROVE",
      "comment": "Save as Electronic File + required fields opens a checkbox-gated acknowledgement modal. UI, all locators MCP_VALIDATION_REQUIRED."
    },
    {
      "itemId": "TS-EC-12000-003",
      "decision": "APPROVE",
      "comment": "Confirming the acknowledgement modal closes both modals and creates the Work Queue item. UI. Writes a real Work Queue entry using fabricated requester/approver data."
    },
    {
      "itemId": "TS-EC-12000-004",
      "decision": "APPROVE",
      "comment": "Cancelling the acknowledgement modal leaves the Paper Out modal open with no Work Queue item created. UI."
    },
    {
      "itemId": "TS-EC-12000-007",
      "decision": "APPROVE",
      "comment": "UI Print to Paper, transaction level, determines Media Type Paper. UI."
    },
    {
      "itemId": "TS-EC-12000-008",
      "decision": "APPROVE",
      "comment": "UI Print to Paper, document level, determines Media Type Paper. UI."
    },
    {
      "itemId": "TS-EC-12000-009",
      "decision": "APPROVE",
      "comment": "UI Save as Electronic File, transaction level, determines Media Type Electronic. UI."
    },
    {
      "itemId": "TS-EC-12000-010",
      "decision": "APPROVE",
      "comment": "UI Save as Electronic File, document level, determines Media Type Electronic. UI."
    },
    {
      "itemId": "TS-EC-12000-011",
      "decision": "APPROVE",
      "comment": "API mediaType=PrintToPaper, transaction level, determines Media Type Paper. HYBRID, scaffoldingOnly - the API step reaches a state, the UI audit-trail assertion judges the AC. eoRequestExport remains API_CONTRACT_UNVERIFIED."
    },
    {
      "itemId": "TS-EC-12000-012",
      "decision": "APPROVE",
      "comment": "API mediaType=PrintToPaper, document level, determines Media Type Paper. HYBRID, same rationale as TS-011."
    },
    {
      "itemId": "TS-EC-12000-013",
      "decision": "APPROVE",
      "comment": "API mediaType=SaveAsElectronicFile, transaction level, determines Media Type Electronic. HYBRID, same rationale as TS-011."
    },
    {
      "itemId": "TS-EC-12000-014",
      "decision": "APPROVE",
      "comment": "API mediaType=SaveAsElectronicFile, document level, determines Media Type Electronic. HYBRID, same rationale as TS-011."
    },
    {
      "itemId": "TS-EC-12000-015",
      "decision": "APPROVE",
      "comment": "API call omitting mediaType entirely determines Media Type Electronic. HYBRID, same rationale as TS-011."
    },
    {
      "itemId": "TS-EC-12000-016",
      "decision": "APPROVE",
      "comment": "Media Type appears as Additional Information on the Submitted Paper Out event, cover page, audit trail and activity history report. UI."
    },
    {
      "itemId": "TS-EC-12000-017",
      "decision": "APPROVE",
      "comment": "Historical records are not retroactively updated with Media Type. UI."
    },
    {
      "itemId": "TS-EC-12000-018",
      "decision": "APPROVE",
      "comment": "Verify Paper Out modal's last checkbox reads the updated verbiage. UI."
    },
    {
      "itemId": "TS-EC-12000-019",
      "decision": "APPROVE",
      "comment": "Paper Out Request modal's right-side section borders are visually aligned. UI, MANUAL_ONLY per the approved plan - step definitions will exist for traceability but the assertion is expected to need human visual confirmation."
    }
  ]
}
