{
  "schemaVersion": "1.0.0",
  "approvalId": "APR-TP-EC-12000-001",
  "gate": "TEST_PLAN",
  "artifactId": "TP-EC-12000-001",
  "artifactVersion": 3,
  "release": "26.3",
  "capability": "paper-out-export",
  "sourceArtifactPath": "test-plans/generated/TP-EC-12000-001.json",
  "decision": "APPROVE",
  "reviewer": {
    "name": "Anil",
    "role": "Reviewer",
    "reference": null
  },
  "reviewedAt": "2026-09-15T11:14:36.707Z",
  "comments": "Answers to CLR-TP-EC-12000-004: (1) Accepted -- automate TS-EC-12000-011 through -015 against the dictated-only eoRequestExport endpoint; assertion remains via the UI audit trail only, never the API response. (2) CLEANUP mechanism: on the Work Queue item, click Print, in the Verify Paper Out modal select the select-all checkbox, click Verify, then confirm the alert dialog -- this clears the item from the Work Queue (mirrors the existing MANUAL_ONLY flow in TS-EC-12000-020, confirmed live against qa5 on 2026-09-15). (3) Fixture selection: do not hard-code a single fixture id -- each scenario must dynamically select an available item from the current Collections list (c1 through c5 observed on 2026-09-15) at run time. All 5 changed scenarios (TS-011 through TS-015) approved on this basis.",
  "itemDecisions": [
    {
      "itemId": "TS-EC-12000-001",
      "decision": "APPROVE",
      "comment": "Unchanged from approved v1. The Paper Out Request modal shows the Media Type section with Print to Paper selected by default"
    },
    {
      "itemId": "TS-EC-12000-002",
      "decision": "APPROVE",
      "comment": "Unchanged from approved v1. Selecting Save as Electronic File and completing required fields opens a checkbox-gated acknowledgement modal"
    },
    {
      "itemId": "TS-EC-12000-003",
      "decision": "APPROVE",
      "comment": "Unchanged from approved v1. Confirming the acknowledgement modal closes both modals and creates the Work Queue approval item"
    },
    {
      "itemId": "TS-EC-12000-004",
      "decision": "APPROVE",
      "comment": "Unchanged from approved v1. Cancelling the acknowledgement modal leaves the Paper Out Request modal open with no Work Queue item created"
    },
    {
      "itemId": "TS-EC-12000-007",
      "decision": "APPROVE",
      "comment": "Unchanged from approved v1. UI Print to Paper at transaction level determines Media Type Paper"
    },
    {
      "itemId": "TS-EC-12000-008",
      "decision": "APPROVE",
      "comment": "Unchanged from approved v1. UI Print to Paper at document level determines Media Type Paper"
    },
    {
      "itemId": "TS-EC-12000-009",
      "decision": "APPROVE",
      "comment": "Unchanged from approved v1. UI Save as Electronic File at transaction level determines Media Type Electronic"
    },
    {
      "itemId": "TS-EC-12000-010",
      "decision": "APPROVE",
      "comment": "Unchanged from approved v1. UI Save as Electronic File at document level determines Media Type Electronic"
    },
    {
      "itemId": "TS-EC-12000-011",
      "decision": "APPROVE",
      "comment": "CHANGED IN v3 - read this one. API mediaType=PrintToPaper at transaction level determines Media Type Paper using the dictated eoRequestExport endpoint (still contractSource UNVERIFIED, scaffoldingOnly true; assertion remains via UI audit trail only)"
    },
    {
      "itemId": "TS-EC-12000-012",
      "decision": "APPROVE",
      "comment": "CHANGED IN v3 - read this one. API mediaType=PrintToPaper at document level determines Media Type Paper using the dictated eoRequestExport endpoint (same caveats as TS-011)"
    },
    {
      "itemId": "TS-EC-12000-013",
      "decision": "APPROVE",
      "comment": "CHANGED IN v3 - read this one. API mediaType=SaveAsElectronicFile at transaction level determines Media Type Electronic using the dictated eoRequestExport endpoint (same caveats as TS-011)"
    },
    {
      "itemId": "TS-EC-12000-014",
      "decision": "APPROVE",
      "comment": "CHANGED IN v3 - read this one. API mediaType=SaveAsElectronicFile at document level determines Media Type Electronic using the dictated eoRequestExport endpoint (same caveats as TS-011)"
    },
    {
      "itemId": "TS-EC-12000-015",
      "decision": "APPROVE",
      "comment": "CHANGED IN v3 - read this one. API call omitting mediaType entirely determines Media Type Electronic using the dictated eoRequestExport endpoint (same caveats as TS-011)"
    },
    {
      "itemId": "TS-EC-12000-016",
      "decision": "APPROVE",
      "comment": "Unchanged from approved v2. Media Type is recorded on the Submitted Paper Out event, not the Authorized one, and appears in the downloaded activity history report"
    },
    {
      "itemId": "TS-EC-12000-020",
      "decision": "APPROVE",
      "comment": "Unchanged from approved v2. Media Type is visible on the Paper Out package cover page"
    },
    {
      "itemId": "TS-EC-12000-017",
      "decision": "APPROVE",
      "comment": "Unchanged from approved v1. Historical Paper Out records are not retroactively updated with Media Type"
    },
    {
      "itemId": "TS-EC-12000-018",
      "decision": "APPROVE",
      "comment": "Unchanged from approved v1. Verify Paper Out modal's last checkbox reads the updated verbiage"
    },
    {
      "itemId": "TS-EC-12000-019",
      "decision": "APPROVE",
      "comment": "Unchanged from approved v1. Paper Out Request modal's right-side section borders are visually aligned"
    }
  ]
}
